videoId,channelId,title,description
_S7BC7wmteE,UC9YF78W5CzUQH3equ0wVYeA,FRYINGPAN @fryingpan9966  @FryingPanLIVEE  @fryingpan9966  @fryingpan9966,
J5CFkWwgVXM,UCxE6qpCeMGgyrae2fV-Lhhg,I hired a new intern!,Instagram ▻ https://www.instagram.com/fryingpan.ig Twitter ▻ https://twitter.com/CodeFryingPan Other channels ▻ @FryingPan ...
ivH26SLXld8,UCfeMEuhdUtxtaUMNSvxq_Xg,When you work from home,love my job btw. internship update soon;) WATCH ME LIVE ▻ https://www.twitch.tv/fryingpan 2nd channel ▻ @FryingPanLIVEE ...
JLEVJ1BLqKk,UCfeMEuhdUtxtaUMNSvxq_Xg,i failed my exams for this job offer (as a software engineer),"yo, i got a job at meta facebook give me ur data. my Coinbase & Cisco offer details: https://youtu.be/gBdI_OSZ1Es @2nd channel ..."
x89mL_cUXEA,UCfeMEuhdUtxtaUMNSvxq_Xg,I graduated + burnout,Filmed this about a week ago. I feel better now :) Travel vlog soon NEW VLOGS ONLY CHANNEL (no coding): @PansDay ...
By5KOsk1pZU,UCJKCD3sbyZLAv08iUkxQCXg,Cooking Crepes with Software Engineering Degenerates,"We were and Toronto and tried making breakfast in an airbnb... Come catch me live every sunday 6pm EST! We code, talk about ..."
iwQMtiDJJak,UCxE6qpCeMGgyrae2fV-Lhhg,Nang wild for that one #shorts,Instagram ▻ https://www.instagram.com/fryingpan.ig Twitter ▻ https://twitter.com/CodeFryingPan Other channels ▻ @FryingPan ...
KrM0HWGBXBo,UCfeMEuhdUtxtaUMNSvxq_Xg,Things Aren&#39;t Going Well...,CURRENTLY IN VEGAS TWITCHCON UPLOADING THIS VIDEO AT 3AM JUST TO KEEP THE STREAK TY FOR THE SUPPORT ...
kAGqDu5YamQ,UCxE6qpCeMGgyrae2fV-Lhhg,I Got Hate Crimed...,Instagram ▻ https://www.instagram.com/fryingpan.ig Twitter ▻ https://twitter.com/CodeFryingPan Other channels ▻ @FryingPan ...
bcH9Tq_FG-U,UCfeMEuhdUtxtaUMNSvxq_Xg,When It&#39;s Your First Coding Interview,yo @twitter - https://twitter.com/CodeFryingPan @twitch - https://www.twitch.tv/fryingpan @2nd channel - @FryingPanLIVEE ...
E_7W58FOAwo,UCfeMEuhdUtxtaUMNSvxq_Xg,I gave away 1200$ to roast my viewers&#39; coding projects,The first 1000 people to use this link will get a 1 month free trial of Skillshare: https://skl.sh/fryingpan02221 ...
YZ5tOe7y9x4,UCfeMEuhdUtxtaUMNSvxq_Xg,Software engineer interns on their first day be like...,it's either this or you're sitting around with nothing to do. update: got a job at facebook :D https://youtu.be/JLEVJ1BLqKk @2nd ...
XokyThIFd-4,UCfeMEuhdUtxtaUMNSvxq_Xg,Day in a life as a Software Engineer and YouTuber,2nd channel for more memes ▻ @FryingPanLIVEE Twitter - updates ▻ https://twitter.com/CodeFryingPan Twitch - watch me live ...
eNIHhsZykWw,UCxE6qpCeMGgyrae2fV-Lhhg,Doing What You Love vs What You Must,"Hi I'm Pan, welcome to my new vlogs channel :) Previous vlog: https://youtu.be/KrM0HWGBXBo?si=cUYarWdtpB2vRcCs Yo ..."
ATzBxKmm6uw,UCfeMEuhdUtxtaUMNSvxq_Xg,When u graduate during a recession :/,"Sry for not posting in awhile, it has been a hectic semester with the scary layoffs and tougher interviews... we stay strong tho ..."
9284aKGiRzo,UCfeMEuhdUtxtaUMNSvxq_Xg,when the coding exam is in person,"going to new york on may 14th for my Facebook/Instagram last internship, will post a vlog soon about that + summarizing my ..."
jF5QiD7uxdc,UCfeMEuhdUtxtaUMNSvxq_Xg,When it&#39;s your first job (as a coding intern),"I THINK I'M DOING WELL RN NOT LIKE IN THE VIDEO I THINK, NEW VLOG NEXT WEEK w/ UPDATES (real). 2nd channel ..."
323ziN0K3rY,UCfeMEuhdUtxtaUMNSvxq_Xg,interns HARD at work in new york,"Yo sup guys. Btw these are footage from 2 weeks ago. Had COVID for a week so video got delayed, will post internship end ..."
thiXwFtNPxo,UCxE6qpCeMGgyrae2fV-Lhhg,That&#39;s what a reindeer does right? #shorts,Instagram ▻ https://www.instagram.com/fryingpan.ig Twitter ▻ https://twitter.com/CodeFryingPan Other channels ▻ @FryingPan ...
4vFtxpdPlzw,UCxE6qpCeMGgyrae2fV-Lhhg,She was supposed to help me move... Not do this... #shorts,Instagram ▻ https://www.instagram.com/fryingpan.ig Twitter ▻ https://twitter.com/CodeFryingPan Other channels ▻ @FryingPan ...
hQ9jY_4leJA,UCxE6qpCeMGgyrae2fV-Lhhg,I Met ALL The Biggest Twitch Streamers...,Twitchcon Vegas was lit. I somehow only lost 1$. Next video... my new apartment :) Previous vlog ...
L3F7KPoE3sc,UCfeMEuhdUtxtaUMNSvxq_Xg,yo i&#39;m in new york,Support me by signing up for free to The Org using my link! https://bit.ly/3z5B4zm ...
zs8c3R7DzFs,UCxE6qpCeMGgyrae2fV-Lhhg,Why did she start doing that? 💀 #shorts,Previous vlog: https://youtu.be/8nENuCpD6vk Instagram ▻ https://www.instagram.com/fryingpan.ig Twitter ...
l2cxqbtPeYI,UCxE6qpCeMGgyrae2fV-Lhhg,"My New NYC Apartment Tour | $5,400/month","WELCOME TO MY NEW VLOGS CHANNEL!! HOPE YOU GUYS LIKED THE TOUR. GREAT LOCATION TOO, 10MINS SUBWAY ..."
MGaV-Wwx_DI,UCfeMEuhdUtxtaUMNSvxq_Xg,They Kicked Me Out... (Apartment Hunting in New York),"I really need to find a place soon, I'm going crazy. Btw will be attending TwitchCon Las Vegas next week! If you see me there say ..."
qgqavVx8zTI,UCxE6qpCeMGgyrae2fV-Lhhg,She thought my PC was something else... #shorts,Previous vlog: https://youtu.be/eNIHhsZykWw?si=57TE-coLja3QrAeA Instagram ▻ https://www.instagram.com/fryingpan.ig Twitter ...
MsgscYHK0SQ,UCfeMEuhdUtxtaUMNSvxq_Xg,I may have failed my courses this semester...,"With finals week here and the holidays approaching, make sure not to lose out on those easy marks with tools like Grammarly!"
tcxRMLTcZlg,UCxE6qpCeMGgyrae2fV-Lhhg,Looks like we homeless for the next 8 months.. 😔 #shorts,Previous vlog: https://youtu.be/8nENuCpD6vk Instagram ▻ https://www.instagram.com/fryingpan.ig Twitter ...
eYfYZQZ-juk,UCfeMEuhdUtxtaUMNSvxq_Xg,I Quit my Job and Moved to New York... Now I&#39;m Homeless,Officially a fully remote software engineer WFH! (Work From Homeless) NEW VLOGS ONLY CHANNEL (no coding): @PansDay ...
tkEUvMeYSIU,UCfeMEuhdUtxtaUMNSvxq_Xg,What I Learned From My Internships (Software Engineering),"If you'd like to participate in my hackathon, apply here! https://www.hack4pan.com/ More details are on the website and in my ..."
GwT6gGMRr9s,UCfeMEuhdUtxtaUMNSvxq_Xg,1 Year of Coding in 5 Minutes (Computer Science First Year),part 2 - how i got my first internship: https://youtu.be/WxqIjeQmQy0 part 3 - why i switched from business to computer science: ...
TIo_ETd9jGI,UCfeMEuhdUtxtaUMNSvxq_Xg,SUCCESS,NEW VLOGS ONLY CHANNEL (no coding): @PansDay Lmk in the comments how you like the new video style bois. A lot of y'all ...
Bj-4OkHIg1o,UCxE6qpCeMGgyrae2fV-Lhhg,Never bring him to a haunted house again #shorts,Instagram ▻ https://www.instagram.com/fryingpan.ig Twitter ▻ https://twitter.com/CodeFryingPan Other channels ▻ @FryingPan ...
xTUbDMs1ML4,UCfeMEuhdUtxtaUMNSvxq_Xg,first day of in-person class after quarantine be like... (as computer science students),"goodbye gpa shoutout to my 2 mcgill university friends in the video, Xin (black shirt) and Philip (blue shirt), you might know them ..."
8nENuCpD6vk,UCfeMEuhdUtxtaUMNSvxq_Xg,She took me apartment hunting... (nyc),Go to our partner https://trymintmobile.com/fryingpan to get premium wireless for as low as $15 a month (offer ends soon ).
gBdI_OSZ1Es,UCfeMEuhdUtxtaUMNSvxq_Xg,My Internship Return Offer... (Software Engineering),"UPDATE!!!: https://youtu.be/JLEVJ1BLqKk So here you go bois, my offers for the upcoming year and salaries of all my internships."
FB4hsf5wr88,UCfeMEuhdUtxtaUMNSvxq_Xg,I Lost My Job... (as a software engineer intern),Support me by signing up for free to The Org using my link! https://bit.ly/3PvHP1R ------------------------------------------ Tough times for ...
XeWOWvSZyRM,UCfeMEuhdUtxtaUMNSvxq_Xg,why I made the change,happy new year :) i got a job at facebook: https://youtu.be/JLEVJ1BLqKk @twitch - https://www.twitch.tv/fryingpan @2nd channel ...
GVFqra7RA1A,UCfeMEuhdUtxtaUMNSvxq_Xg,We Went Apartment Hunting in New York,"Hope y'all enjoying the vlogs so far, let me know in the comments! Gonna try to keep this frequent upload schedule :) ... and ..."
NdpnOZt-PmE,UCfeMEuhdUtxtaUMNSvxq_Xg,I Lost My Job... Again (for real this time),This is the greatest Christmas gift of all time. If you have a job that you can refer me lmao: fullstackpan@gmail.com My Linkedin: ...
t_T0yn-R6uo,UCfeMEuhdUtxtaUMNSvxq_Xg,"I just quit my $400,000 a year job lol",soooooo yeeeeeaahh......... new video next week homeless asian man in new york pls support ...
Ye8gnDR0KMw,UCxE6qpCeMGgyrae2fV-Lhhg,Moving into My New Apartment in New York,MOVING INTO MY NEW APARTMENT THEN WENT HAUNTED HOUSE FOR HALLOWEEN. OFFICIAL APARTMENT TOUR ...
LQZWeBzhoYg,UCfeMEuhdUtxtaUMNSvxq_Xg,He rejected FAANG to work at a startup... was it worth it?,I interviewed my friend Xinchi who's a graduating mechanical engineer major at McGill University. He first rejected Apple to work ...
WrD02VBXpEg,UCfeMEuhdUtxtaUMNSvxq_Xg,Applying to tech jobs in 2023 be like...,Go to https://squarespace.com/fryingpan to get a free trial and 10% off your first purchase of a website or domain!
dNlilzQ148o,UCxE6qpCeMGgyrae2fV-Lhhg,I Moved To New York Without A Place To Stay... #shorts,I finally found a place! https://youtu.be/Ye8gnDR0KMw Instagram ▻ https://www.instagram.com/fryingpan.ig Twitter ...
G2YfRcQHSQ8,UCOOSbGS0V1OV4HUIyHwbVsA,Frying Pan 2023 #kitchen #technology #trending #homeappliances #shorts #viral,Frying Pan 2023 #kitchen #technology #trending #homeappliances #shorts #viral @FryingPan @fryingpan9966 ...
IYTfNhZcry0,UCxE6qpCeMGgyrae2fV-Lhhg,What you can get for 5k/month in New York #shorts,Previous vlog: https://youtu.be/l2cxqbtPeYI Instagram ▻ https://www.instagram.com/fryingpan.ig Twitter ...
fIFsBCxlqWY,UCfeMEuhdUtxtaUMNSvxq_Xg,I got the job... but at what cost?,"I think I might've somehow got the highest rating on intern performance, it seems that the few of us with that got an offer. Guess I'm ..."
1JDrsOiNPBs,UCfeMEuhdUtxtaUMNSvxq_Xg,I Got a New Job and Moved to California...,"NEW VLOGS ONLY CHANNEL (no coding): @PansDay Hello world, I am now a standardized Californian technology male. I go to ..."
sPZ_EqJOjY8,UC8u9p5NAPTEEUxbWGz5bw8Q,durlove bhi,durlov bhai please find my name @ImagineDragons @sofynia @faiyazfaisaltoo @ShegaonTirthKshetra @fyiureusufsyy3591 ...
